Wedgwood Baptist Church shooting,15,"Fort Worth, Texas",Yes,Mass,"{""illness"": 10, ""shot"": 37, ""mental"": 26, ""people"": 16, ""dead"": 10, ""three"": 16, ""committed"": 10, ""shooting"": 14, ""suicide"": 37, ""police"": 43, ""opened"": 46, ""army"": 10, ""two"": 25, ""killed"": 28, ""health"": 17, ""suffered"": 11, ""committing"": 20, ""fire"": 50, ""psychiatric"": 10, ""killing"": 17, ""said"": 15, ""others"": 13, ""former"": 19, ""school"": 14, ""rampage"": 11, ""inside"": 13, ""later"": 19, ""arrested"": 17, ""workplace"": 10, ""history"": 12}",7,Two semiautomatic handguns,http://www.nytimes.com/1999/09/18/us/death-in-a-church-the-overview-with-question-of-why-unanswered-fort-worth-mourns.html,32.693397,".380-caliber, 9mm Ruger P85 semiautomatic handguns",Male,Religious,"Larry Gene Ashbrook, 47, opened fire inside the Wedgwood Baptist Church during a prayer rally before committing suicide.","['larry', 'gene', 'ashbrook', '47', 'opened', 'fire', 'inside', 'wedgwood', 'baptist', 'church', 'prayer', 'rally', 'committing', 'suicide', 'siblings', 'decribed', 'paranoid', 'schizophrenic']",9/15/1999,white,Yes,His siblings decribed him as a paranoid schizophrenic. ,-97.47067092,http://www.nytimes.com/1999/09/20/us/fort-worth-remembers-those-killed-at-church.html?pagewanted=all&src=pm; http://www.nytimes.com/1999/09/18/us/death-in-a-church-the-overview-with-question-of-why-unanswered-fort-worth-mourns.html; http://www.vpc.org/studies/wgun990915.htm,8,1999,"Trader's Village flea market in Grand Prairie, Texas"
Atlanta day trading spree killings,22,"Atlanta, Georgia",Yes,Spree,"{""illness"": 10, ""shot"": 37, ""mental"": 26, ""people"": 16, ""dead"": 10, ""three"": 16, ""committed"": 10, ""shooting"": 14, ""suicide"": 37, ""police"": 43, ""opened"": 46, ""army"": 10, ""two"": 25, ""killed"": 28, ""health"": 17, ""suffered"": 11, ""committing"": 20, ""fire"": 50, ""psychiatric"": 10, ""killing"": 17, ""said"": 15, ""others"": 13, ""former"": 19, ""school"": 14, ""rampage"": 11, ""inside"": 13, ""later"": 19, ""arrested"": 17, ""workplace"": 10, ""history"": 12}",13,"Three semiautomatic handguns, one revolver",http://www.independent.co.uk/news/i-dont-plan-to-live-much-longer-just-long-enough-to-kill-the-people-that-greedily-sought-my-destruction-1109610.html,33.7490987,".45-caliber Colt 1911-A1, 9mm Glock 17, .25-caliber Raven Arms MP-25 semiautomatic handguns; .22-caliber Harrington & Richardson revolver",Male,Workplace,"Day trader Mark O. Barton, 44, who had recently lost a substantial sum of money, went on a shooting spree through two day-trading firms. He started at the All-Tech Investment Group, where he worked, then went on to Momentum Securities. He fled and hours later, after being cornered by police outside a gas station, committed suicide. (Two days before the spree, he killed his wife and two children with a hammer.)","['day', 'trader', 'mark', 'o', 'barton', '44', 'recently', 'lost', 'substantial', 'sum', 'money', 'went', 'shooting', 'spree', 'two', 'day', 'trading', 'firms', 'started', 'tech', 'investment', 'group', 'worked', 'went', 'momentum', 'securities', 'fled', 'hours', 'later', 'cornered', 'police', 'outside', 'gas', 'station', 'committed', 'suicide', 'two', 'days', 'spree', 'killed', 'wife', 'two', 'children', 'hammer', 'letters', 'details', 'deep', 'depression', 'downward', 'spiral']",7/29/1999,white,Yes,"In letters, he details his deep depression and downward spiral. ",-84.3901849,http://www.independent.co.uk/news/i-dont-plan-to-live-much-longer-just-long-enough-to-kill-the-people-that-greedily-sought-my-destruction-1109610.html; http://articles.cnn.com/1999-07-30/us/9907_30_atlanta.shooting.06_1_gladys-barton-debra-spivey-barton-note?_s=PM:US; http://www.vpc.org/studies/wgun990729.htm,9,1999,"Glock purchased from gun store in Warner Robins, Ga. "
Columbine High School massacre,37,"Littleton, Colorado",Yes,Mass,"{""illness"": 10, ""shot"": 37, ""mental"": 26, ""people"": 16, ""dead"": 10, ""three"": 16, ""committed"": 10, ""shooting"": 14, ""suicide"": 37, ""police"": 43, ""opened"": 46, ""army"": 10, ""two"": 25, ""killed"": 28, ""health"": 17, ""suffered"": 11, ""committing"": 20, ""fire"": 50, ""psychiatric"": 10, ""killing"": 17, ""said"": 15, ""others"": 13, ""former"": 19, ""school"": 14, ""rampage"": 11, ""inside"": 13, ""later"": 19, ""arrested"": 17, ""workplace"": 10, ""history"": 12}",24,"One semiautomatic handgun (assault), one rifle (assault), two shotguns",http://www.slate.com/articles/news_and_politics/assessment/2004/04/the_depressive_and_the_psychopath.html,39.6021065,"9mm Intratec DC-9 semiautomatic handgun; 9mm Hi-Point 995 carbine rifle; 12-gauge sawed-off Savage Stevens 311D, 12-gauge sawed-off Savage Springfield 67H pump-action shotguns",Male,School,"Eric Harris, 18, and Dylan Klebold, 17, opened fire throughout Columbine High School before committing suicide.","['eric', 'harris', '18', 'dylan', 'klebold', '17', 'opened', 'fire', 'throughout', 'columbine', 'high', 'school', 'committing', 'suicide', 'harris', 'alleged', 'psychopath', 'klebold', 'depressed', 'suicidal']",4/20/1999,white,No,Harris was an alleged psychopath; Klebold was depressed and suicidal.,-104.9877273,http://www.usatoday.com/news/nation/2009-04-13-columbine-myths_N.htm; http://www.vpc.org/studies/wgun990420.htm; http://www.slate.com/articles/news_and_politics/assessment/2004/04/the_depressive_and_the_psychopath.html,13,1999,"Purchased variously at Tanner Gun Show in Denver, Colo. and from an individual"
Thurston High School shooting,29,"Springfield, Oregon",Yes,Spree,"{""illness"": 10, ""shot"": 37, ""mental"": 26, ""people"": 16, ""dead"": 10, ""three"": 16, ""committed"": 10, ""shooting"": 14, ""suicide"": 37, ""police"": 43, ""opened"": 46, ""army"": 10, ""two"": 25, ""killed"": 28, ""health"": 17, ""suffered"": 11, ""committing"": 20, ""fire"": 50, ""psychiatric"": 10, ""killing"": 17, ""said"": 15, ""others"": 13, ""former"": 19, ""school"": 14, ""rampage"": 11, ""inside"": 13, ""later"": 19, ""arrested"": 17, ""workplace"": 10, ""history"": 12}",25,"Two semiautomatic handguns, one rifle",http://articles.cnn.com/2000-01-21/us/kinkel.revisited_1_kip-kinkel-thurston-high-school-oregon-school-shooting?_s=PM:US,44.0462362,"9mm Glock, .22-caliber Ruger semiautomatic handguns, .22-caliber Ruger rifle",Male,School,"After he was expelled for having a gun in his locker, Kipland P. Kinkel, 15, a freshman at Thurston High, went on a shooting spree, killing his parents at home and two students at school. Five classmates wrestled Kipland to the ground before he was arrested.   ","['expelled', 'gun', 'locker', 'kipland', 'p', 'kinkel', '15', 'freshman', 'thurston', 'high', 'went', 'shooting', 'spree', 'killing', 'parents', 'home', 'two', 'students', 'school', 'five', 'classmates', 'wrestled', 'kipland', 'ground', 'arrested', 'doctors', 'testified', 'paranoid', 'schizophrenic', 'suffered', 'hallucinations']",5/21/1998,white,No,Doctors testified that he was a paranoid schizophrenic who suffered from hallucinations,-123.0220289,http://www.katu.com/news/local/8082147.html; http://www.pbs.org/wgbh/pages/frontline/shows/kinkel/kip/cron.html; http://www.oregonlive.com/special/index.ssf/2008/05/the_suspect_kipland_kinkels_da.html; http://articles.cnn.com/2000-01-21/us/kinkel.revisited_1_kip-kinkel-thurston-high-school-oregon-school-shooting?_s=PM:US,4,1998,"Purchased variously from friend and father, and stolen from father"
Westside Middle School killings,15,"Jonesboro, Arkansas",No,Mass,"{""illness"": 10, ""shot"": 37, ""mental"": 26, ""people"": 16, ""dead"": 10, ""three"": 16, ""committed"": 10, ""shooting"": 14, ""suicide"": 37, ""police"": 43, ""opened"": 46, ""army"": 10, ""two"": 25, ""killed"": 28, ""health"": 17, ""suffered"": 11, ""committing"": 20, ""fire"": 50, ""psychiatric"": 10, ""killing"": 17, ""said"": 15, ""others"": 13, ""former"": 19, ""school"": 14, ""rampage"": 11, ""inside"": 13, ""later"": 19, ""arrested"": 17, ""workplace"": 10, ""history"": 12}",10,"Two semiautomatic handguns, two rifles, three revolvers, two derringers",http://www.nytimes.com/1998/03/29/us/from-wild-talk-and-friendship-to-five-deaths-in-a-schoolyard.html?sec=&spon=&pagewanted=all,35.8209895,"FIE 380, .380-caliber Star semiautomatic handguns; .44 Magnum Ruger, .30-06 Remington 742, .30-caliber Universal M-1 carbine replica rifles; .38-caliber Charter Arms, .357-caliber Ruger Security Six, .38-caliber Smith & Wesson revolvers; .22-caliber Double Deuce Buddie two-shot, .38-caliber Davis Industries two-shot derringers",Male,School,"Mitchell Scott Johnson, 13, and Andrew Douglas Golden, 11, two juveniles, ambushed students and teachers as they left the school; they were apprehended by police at the scene.","['mitchell', 'scott', 'johnson', '13', 'andrew', 'douglas', 'golden', '11', 'two', 'juveniles', 'ambushed', 'students', 'teachers', 'left', 'school', 'apprehended', 'police', 'scene', 'boys', 'displayed', 'unruly', 'aggressive', 'behavior', 'picked', 'kids', 'made', 'threats', 'killing', 'people']",3/24/1998,white,No,Boys displayed unruly and aggressive behavior. They picked on kids and made threats about killing people. ,-90.6682606,http://www.vpc.org/studies/wgun980324.htm,5,1998,Stolen from grandfather and father
Connecticut Lottery shooting,6,"Newington, Connecticut",Yes,Mass,"{""illness"": 10, ""shot"": 37, ""mental"": 26, ""people"": 16, ""dead"": 10, ""three"": 16, ""committed"": 10, ""shooting"": 14, ""suicide"": 37, ""police"": 43, ""opened"": 46, ""army"": 10, ""two"": 25, ""killed"": 28, ""health"": 17, ""suffered"": 11, ""committing"": 20, ""fire"": 50, ""psychiatric"": 10, ""killing"": 17, ""said"": 15, ""others"": 13, ""former"": 19, ""school"": 14, ""rampage"": 11, ""inside"": 13, ""later"": 19, ""arrested"": 17, ""workplace"": 10, ""history"": 12}",1,One semiautomatic handgun,http://www.nytimes.com/2000/04/11/us/hole-in-gun-control-law-lets-mentally-ill-through.html?pagewanted=all&src=pm,41.6856325,9mm semiautomatic handgun,Male,Workplace,"Lottery worker Matthew Beck, 35, gunned down four bosses over a salary dispute before committing suicide.","['lottery', 'worker', 'matthew', 'beck', '35', 'gunned', 'four', 'bosses', 'salary', 'dispute', 'committing', 'suicide', 'hospitalized', 'psychiatric', 'reasons', 'history', 'depression']",3/6/1998,white,Yes,He had been hospitalized for psychiatric reasons and had a history of depression,-72.72983827,http://www.nytimes.com/1998/03/07/nyregion/rampage-connecticut-overview-connecticut-lottery-worker-kills-4-bosses-then.html?pagewanted=all&src=pm; http://www.nytimes.com/2000/04/11/us/hole-in-gun-control-law-lets-mentally-ill-through.html?pagewanted=all&src=pm,5,1998,Unknown
Caltrans maintenance yard shooting,7,"Orange, California",No,Mass,"{""illness"": 10, ""shot"": 37, ""mental"": 26, ""people"": 16, ""dead"": 10, ""three"": 16, ""committed"": 10, ""shooting"": 14, ""suicide"": 37, ""police"": 43, ""opened"": 46, ""army"": 10, ""two"": 25, ""killed"": 28, ""health"": 17, ""suffered"": 11, ""committing"": 20, ""fire"": 50, ""psychiatric"": 10, ""killing"": 17, ""said"": 15, ""others"": 13, ""former"": 19, ""school"": 14, ""rampage"": 11, ""inside"": 13, ""later"": 19, ""arrested"": 17, ""workplace"": 10, ""history"": 12}",2,One rifle (assault),http://articles.latimes.com/1997/dec/20/news/mn-431,33.7877944,7.62mm AK-47 Chinese variant semiautomatic rifle,Male,Workplace,"Former Caltrans employee Arturo Reyes Torres, 41, opened fire at a maintenance yard after he was fired for allegedly selling government materials he'd stolen from work. He was shot dead by police.","['former', 'caltrans', 'employee', 'arturo', 'reyes', 'torres', '41', 'opened', 'fire', 'maintenance', 'yard', 'fired', 'allegedly', 'selling', 'government', 'materials', 'stolen', 'work', 'shot', 'dead', 'police', 'disgruntled', 'fired']",12/18/1997,Latino,Yes,He was disgruntled after being fired. ,-117.8531119,"http://articles.latimes.com/1997/dec/20/news/mn-431; http://articles.latimes.com/1997/dec/22/local/me-1156; http://www.vpc.org/studies/wgun971218.htm; http://news.google.com/newspapers?id=DitZAAAAIBAJ&sjid=LEcNAAAAIBAJ&pg=6705,2243998&dq=arturo+reyes+torres+caltrans&hl=en",5,1997,"B&B Gun Sales in Orange County, Calif."
R.E. Phelon Company shooting,7,"Aiken, South Carolina",No,Mass,"{""illness"": 10, ""shot"": 37, ""mental"": 26, ""people"": 16, ""dead"": 10, ""three"": 16, ""committed"": 10, ""shooting"": 14, ""suicide"": 37, ""police"": 43, ""opened"": 46, ""army"": 10, ""two"": 25, ""killed"": 28, ""health"": 17, ""suffered"": 11, ""committing"": 20, ""fire"": 50, ""psychiatric"": 10, ""killing"": 17, ""said"": 15, ""others"": 13, ""former"": 19, ""school"": 14, ""rampage"": 11, ""inside"": 13, ""later"": 19, ""arrested"": 17, ""workplace"": 10, ""history"": 12}",3,One semiautomatic handgun,http://chronicle.augusta.com/stories/1997/09/18/met_214833.shtml,33.5598586,9mm semiautomatic handgun,Male,Workplace,"Ex-con Hastings Arthur Wise, 43, opened fire at the R.E. Phelon Company in retaliation for being fired after an argument with a supervisor. He attempted suicide by ingesting insecticide, failed, and was executed by the state of South Carolina eight years later.","['ex', 'con', 'hastings', 'arthur', 'wise', '43', 'opened', 'fire', 'r', 'e', 'phelon', 'company', 'retaliation', 'fired', 'argument', 'supervisor', 'attempted', 'suicide', 'ingesting', 'insecticide', 'failed', 'executed', 'state', 'south', 'carolina', 'eight', 'years', 'later', 'ex', 'con', 'freed', 'prison', 'although', 'displayed', 'violent', 'tendencies']",9/15/1997,black,No,"An ex-con, he had been freed from prison, although he displayed violent tendencies.",-81.721952,http://www.vpc.org/studies/wgun970915.htm; http://chronicle.augusta.com/stories/1997/09/18/met_214833.shtml,4,1997,Unknown
Fort Lauderdale revenge shooting,7,"Fort Lauderdale, Florida",Yes,Mass,"{""illness"": 10, ""shot"": 37, ""mental"": 26, ""people"": 16, ""dead"": 10, ""three"": 16, ""committed"": 10, ""shooting"": 14, ""suicide"": 37, ""police"": 43, ""opened"": 46, ""army"": 10, ""two"": 25, ""killed"": 28, ""health"": 17, ""suffered"": 11, ""committing"": 20, ""fire"": 50, ""psychiatric"": 10, ""killing"": 17, ""said"": 15, ""others"": 13, ""former"": 19, ""school"": 14, ""rampage"": 11, ""inside"": 13, ""later"": 19, ""arrested"": 17, ""workplace"": 10, ""history"": 12}",1,"One semiautomatic handgun, one revolver",http://articles.sun-sentinel.com/1996-02-11/news/9602110026_1_beach-crew-maintenance-fort-lauderdale,26.1223084,9mm Glock semiautomatic handgun; .32-caliber revolver,Male,Workplace,"Fired city park employee Clifton McCree, 41, opened fire on former coworkers he called ""racist devils"" inside their municipal trailer in an act of revenge after failing a drug test. He then committed suicide.","['fired', 'city', 'park', 'employee', 'clifton', 'mccree', '41', 'opened', 'fire', 'former', 'coworkers', 'called', 'racist', 'devils', 'inside', 'municipal', 'trailer', 'act', 'revenge', 'failing', 'drug', 'test', 'committed', 'suicide', 'co', 'workers', 'complained', 'threats', 'verbal', 'abuse', 'supervisors', 'asked', 'get', 'psychiatric', 'evaluation', 'lost', 'job', 'relatives', 'said', 'drove', 'depression']",2/9/1996,black,Yes,"Co-workers complained about his threats and verbal abuse. His supervisors asked him to get a psychiatric evaluation. He lost his job, which relatives said drove his depression.",-80.1433786,http://www.nytimes.com/1996/02/11/us/florida-killer-said-victims-were-racists-police-say.html; http://articles.sun-sentinel.com/1996-02-10/news/9602090635_1_million-firearms-multiple-guns-reloading,6,1996,Unknown
Walter Rossler Company massacre,6,"Corpus Christi, Texas",No,Mass,"{""illness"": 10, ""shot"": 37, ""mental"": 26, ""people"": 16, ""dead"": 10, ""three"": 16, ""committed"": 10, ""shooting"": 14, ""suicide"": 37, ""police"": 43, ""opened"": 46, ""army"": 10, ""two"": 25, ""killed"": 28, ""health"": 17, ""suffered"": 11, ""committing"": 20, ""fire"": 50, ""psychiatric"": 10, ""killing"": 17, ""said"": 15, ""others"": 13, ""former"": 19, ""school"": 14, ""rampage"": 11, ""inside"": 13, ""later"": 19, ""arrested"": 17, ""workplace"": 10, ""history"": 12}",0,"One semiautomatic handgun, one revolver",http://web.caller.com/2000/april/03/today/local_ne/4127.html,27.823713,9mm Ruger semiautomatic handgun; .32-caliber revolver,Male,Workplace,"Disgruntled former metallurgist James Daniel Simpson, 28, opened fire throughout the Walter Rossler Company where he had worked before exiting the building and committing suicide.","['disgruntled', 'former', 'metallurgist', 'james', 'daniel', 'simpson', '28', 'opened', 'fire', 'throughout', 'walter', 'rossler', 'company', 'worked', 'exiting', 'building', 'committing', 'suicide', 'likely', 'angry', 'given', 'assignment', 'work', 'like', 'acquaintances', 'know', 'come', 'back', 'kill']",4/3/1995,unclear,Yes,He was likely angry because he was given an assignment at work he didn't like. But acquaintances didn't know why he'd come back and kill.,-97.41739794,http://web.caller.com/2000/april/03/today/local_ne/4127.html,6,1995,Unknown
Air Force base shooting,28,"Fairchild Air Force Base, Washington",Yes,Mass,"{""illness"": 10, ""shot"": 37, ""mental"": 26, ""people"": 16, ""dead"": 10, ""three"": 16, ""committed"": 10, ""shooting"": 14, ""suicide"": 37, ""police"": 43, ""opened"": 46, ""army"": 10, ""two"": 25, ""killed"": 28, ""health"": 17, ""suffered"": 11, ""committing"": 20, ""fire"": 50, ""psychiatric"": 10, ""killing"": 17, ""said"": 15, ""others"": 13, ""former"": 19, ""school"": 14, ""rampage"": 11, ""inside"": 13, ""later"": 19, ""arrested"": 17, ""workplace"": 10, ""history"": 12}",23,One rifle (assault),http://articles.latimes.com/1994-06-22/news/mn-7137_1_air-force,47.61864486,MAK-90 semiautomatic rifle,Male,Military,"Former airman Dean Allen Mellberg, 20, opened fire inside a hospital at the Fairchild Air Force Base before he was shot dead by a military police officer outside.","['former', 'airman', 'dean', 'allen', 'mellberg', '20', 'opened', 'fire', 'inside', 'hospital', 'fairchild', 'air', 'force', 'base', 'shot', 'dead', 'military', 'police', 'officer', 'outside', 'repeatedly', 'diagnosed', 'emotional', 'problems', 'two', 'years', 'service']",6/20/1994,white,Yes,He was repeatedly diagnosed with emotional problems during his two years of service.,-117.6483587,http://articles.latimes.com/1994-06-22/news/mn-7137_1_air-force; http://www.nytimes.com/1994/06/22/us/an-airman-s-revenge-5-minutes-of-terror.html,5,1994,"Gun dealer in Spokane, Wash."
Chuck E. Cheese's killings,5,"Aurora, Colorado",Unclear,Mass,"{""illness"": 10, ""shot"": 37, ""mental"": 26, ""people"": 16, ""dead"": 10, ""three"": 16, ""committed"": 10, ""shooting"": 14, ""suicide"": 37, ""police"": 43, ""opened"": 46, ""army"": 10, ""two"": 25, ""killed"": 28, ""health"": 17, ""suffered"": 11, ""committing"": 20, ""fire"": 50, ""psychiatric"": 10, ""killing"": 17, ""said"": 15, ""others"": 13, ""former"": 19, ""school"": 14, ""rampage"": 11, ""inside"": 13, ""later"": 19, ""arrested"": 17, ""workplace"": 10, ""history"": 12}",1,One semiautomatic handgun,"http://www.5280.com/magazine/2008/12/politics-killing?page=0,6",39.754713,.25-caliber semiautomatic handgun,Male,Workplace,"Nathan Dunlap, 19, a recently fired Chuck E. Cheese's employee, went on a rampage through his former workplace and was arrested the following day. He now awaits execution on death row.","['nathan', 'dunlap', '19', 'recently', 'fired', 'chuck', 'e', ""cheese's"", 'employee', 'went', 'rampage', 'former', 'workplace', 'arrested', 'following', 'day', 'now', 'awaits', 'execution', 'death', 'row', 'prison', 'awaiting', 'trial', 'started', 'acting', 'bizarre', 'stripping', 'naked', 'playing', 'feces', 'apparently', 'avoid', 'death', 'penalty', 'state', 'doctor', 'testified', 'dunlap', 'faking', 'mental', 'illness']",12/14/1993,black,Unknown,"While he was in prison awaiting trial, he started acting bizarre by stripping naked and playing with his feces, apparently to avoid the death penalty. A state doctor testified that Dunlap was was faking his mental illness. ",-104.835869,"http://www.denverpost.com/news/ci_20218952/aurora-chuck-e-cheese-killers-appeal-cites-mental; http://abcnews.go.com/US/auroras-massacre-victims-20-year-wait-justice/story?id=16847013; http://www.5280.com/magazine/2008/12/politics-killing?page=0,6 ",4,1993,Unknown
Long Island Rail Road massacre,25,"Garden City, New York",Yes,Mass,"{""illness"": 10, ""shot"": 37, ""mental"": 26, ""people"": 16, ""dead"": 10, ""three"": 16, ""committed"": 10, ""shooting"": 14, ""suicide"": 37, ""police"": 43, ""opened"": 46, ""army"": 10, ""two"": 25, ""killed"": 28, ""health"": 17, ""suffered"": 11, ""committing"": 20, ""fire"": 50, ""psychiatric"": 10, ""killing"": 17, ""said"": 15, ""others"": 13, ""former"": 19, ""school"": 14, ""rampage"": 11, ""inside"": 13, ""later"": 19, ""arrested"": 17, ""workplace"": 10, ""history"": 12}",19,One semiautomatic handgun,http://www.nytimes.com/1993/12/12/nyregion/tormented-life-special-report-long-slide-privilege-ends-slaughter-train.html,40.7267682,9mm Ruger P89 semiautomatic handgun,Male,Other,"Colin Ferguson, 35, opened fire on an eastbound Long Island Rail Road train as it approached a Garden City station. He was later arrested.","['colin', 'ferguson', '35', 'opened', 'fire', 'eastbound', 'long', 'island', 'rail', 'road', 'train', 'approached', 'garden', 'city', 'station', 'later', 'arrested', 'psychiatrists', 'others', 'said', 'suffered', 'racial', 'paranoia', 'obsessed', 'nonexistent', 'conspiracies', 'landlord', 'said', 'delusions', 'grandeur']",12/7/1993,black,Yes,"Psychiatrists and others said he suffered from racial paranoia and was obsessed with nonexistent conspiracies. His landlord said he had ""delusions of grandeur.""",-73.6342955,http://www.nytimes.com/1993/12/12/nyregion/tormented-life-special-report-long-slide-privilege-ends-slaughter-train.html; http://www.vpc.org/studies/wgun931207.htm,6,1993,"Turner's Outdoorsman in Signal Hill, Calif. "
Luigi's shooting,12,"Fayetteville, North Carolina",No,Mass,"{""illness"": 10, ""shot"": 37, ""mental"": 26, ""people"": 16, ""dead"": 10, ""three"": 16, ""committed"": 10, ""shooting"": 14, ""suicide"": 37, ""police"": 43, ""opened"": 46, ""army"": 10, ""two"": 25, ""killed"": 28, ""health"": 17, ""suffered"": 11, ""committing"": 20, ""fire"": 50, ""psychiatric"": 10, ""killing"": 17, ""said"": 15, ""others"": 13, ""former"": 19, ""school"": 14, ""rampage"": 11, ""inside"": 13, ""later"": 19, ""arrested"": 17, ""workplace"": 10, ""history"": 12}",8,"One rifle, two shotguns","http://news.google.com/newspapers?id=0AhPAAAAIBAJ&sjid=jhUEAAAAIBAJ&pg=6505,2482529&dq=kenneth+junior+french&hl=en",35.0529931,.22-caliber rifle; two 12-gauge shotguns,Male,Other,"Army Sgt. Kenneth Junior French, 22, opened fire inside Luigi's Italian restaurant while ranting about gays in the military before he was shot and arrested by police.","['army', 'sgt', 'kenneth', 'junior', 'french', '22', 'opened', 'fire', 'inside', ""luigi's"", 'italian', 'restaurant', 'ranting', 'gays', 'military', 'shot', 'arrested', 'police', 'abusive', 'father', 'committed', 'suicide']",8/6/1993,white,Yes,"He had an abusive father, who committed suicide.",-78.8787058,"http://articles.latimes.com/1993-08-08/news/mn-21847_1_kills-army-french; http://news.google.com/newspapers?id=0AhPAAAAIBAJ&sjid=jhUEAAAAIBAJ&pg=6505,2482529&dq=kenneth+junior+french&hl=en",4,1993,Unknown
101 California Street shootings,15,"San Francisco, California",No,Mass,"{""illness"": 10, ""shot"": 37, ""mental"": 26, ""people"": 16, ""dead"": 10, ""three"": 16, ""committed"": 10, ""shooting"": 14, ""suicide"": 37, ""police"": 43, ""opened"": 46, ""army"": 10, ""two"": 25, ""killed"": 28, ""health"": 17, ""suffered"": 11, ""committing"": 20, ""fire"": 50, ""psychiatric"": 10, ""killing"": 17, ""said"": 15, ""others"": 13, ""former"": 19, ""school"": 14, ""rampage"": 11, ""inside"": 13, ""later"": 19, ""arrested"": 17, ""workplace"": 10, ""history"": 12}",6,Three semiautomatic handguns (two assault),http://articles.latimes.com/1993-07-03/news/mn-10731_1_mortgage-business,37.7789601,"Two Intratec DC-9, .45-caliber Colt semiautomatic handguns",Male,Other,"Failed businessman Gian Luigi Ferri, 55, opened fire throughout an office building before he committed suicide inside as police pursued him.","['failed', 'businessman', 'gian', 'luigi', 'ferri', '55', 'opened', 'fire', 'throughout', 'office', 'building', 'committed', 'suicide', 'inside', 'police', 'pursued', 'luck', 'failed', 'business', 'decisions', 'one', 'acquaintance', 'said', 'least', 'likely', 'guy', 'can', 'imagine', 'something', 'like', 'ex', 'wife', 'said', 'hated', 'violence']",7/1/1993,white,No,"He was down on his luck because of failed business decisions. One acquaintance said, ""He was the least likely guy you can imagine doing something like that.""  His ex-wife said he ""hated violence.""",-122.419199,http://articles.latimes.com/1993-07-03/news/mn-10731_1_mortgage-business/2; http://www.motherjones.com/print/16316; http://www.vpc.org/studies/wgun930701.htm,9,1993,"Super Pawn and Pacific Tactical Weapons, both in Las Vegas, Nev."
